product_id,name,slug,category_tags,applies_to_food_ids,applies_to_categories,applies_to_scenarios,priority,affiliate_url,image_url,notes
instant_read_thermometer,Instant Read Digital Thermometer,instant-read-thermometer,thermometer,,protein|seafood|dairy|cooked_foods,sitout|outage,1,https://example.com/affiliate/instant-read-thermometer,https://example.com/img/instant-read-thermometer.jpg,Use for quick temperature checks
fridge_freezer_thermometer,Fridge and Freezer Thermometer,fridge-freezer-thermometer,fridge_thermometer|thermometer,,,outage|storage,1,https://example.com/affiliate/fridge-freezer-thermometer,https://example.com/img/fridge-freezer-thermometer.jpg,Helps monitor appliance temperature drift
vacuum_sealer_kit,Vacuum Sealer Starter Kit,vacuum-sealer-kit,vacuum_sealer,,protein|seafood|cooked_foods,freezer|storage,2,https://example.com/affiliate/vacuum-sealer-kit,https://example.com/img/vacuum-sealer-kit.jpg,Reduces freezer burn risk
heavy_duty_freezer_bags,Heavy Duty Freezer Bags,heavy-duty-freezer-bags,freezer_bag,,,freezer|storage,2,https://example.com/affiliate/heavy-duty-freezer-bags,https://example.com/img/heavy-duty-freezer-bags.jpg,Useful for portioning and freezing
glass_storage_containers,Glass Storage Containers with Lids,glass-storage-containers,container,,,storage|sitout,3,https://example.com/affiliate/glass-storage-containers,https://example.com/img/glass-storage-containers.jpg,Supports rapid cooling and safer leftovers
produce_storage_bins,Produce Storage Bins,produce-storage-bins,container,,produce,storage,3,https://example.com/affiliate/produce-storage-bins,https://example.com/img/produce-storage-bins.jpg,Helps keep produce dry and organized
dairy_storage_pitcher,Cold Storage Dairy Pitcher,dairy-storage-pitcher,container,,dairy,storage|outage,3,https://example.com/affiliate/dairy-storage-pitcher,https://example.com/img/dairy-storage-pitcher.jpg,Designed for cold temperature retention
